Order,Salt_help01,Salt_help02,Salt_help03
1,Presentación de Reactivos,Hidróxido e Hidrácido son puestos separados por un signo  '+'  siendo ambos reactivos. A la derecha del Hidrácido una flecha denominada ´'Flecha de Reacción'. Los productos seránd detallados luego de la flecha.,En proceso…
2,Presentación de Productos (Sal y Agua),"En productos detallamos la Sal y Agua, separadas ambas por el signo '+'.
Sal sin subíndices.
Agua con los subíndices de su fórmula química normal.
No se agregan coeficientes (Coeficientes igual a 1 para Sal y Agua).",En proceso…
3,Detalles de la Sal,"Los subíndices en la Sal son cambiados.
En la Sal, el nuevo índice del No-Metal es la valencia del Metal.
En la Sal, el nuevo subíndice del Metal es la valencia del No-Metal.",En proceso…
4,Simplificación de subíndices en la Sal,"Si es posible debemos simplificar los subíndices dentro de la Sal.
Si esto sucede, solo simplificamos y no cambiamos el coeficiente de la Sal en tal caso.",En proceso…
5,Balance del Metal,El nuevo coeficiente del Hidróxido en reacitovs es el subíndice del Metal en la Sal.,En proceso…
6,Balance del No Metal,El nuevo coeficiente para el Hidrácido en reactivos será el subíndice del No-Metal en la Sal.,En proceso…
7,Balance del Hidr[ogeno,"Procedemos a balancear el Hidrógeno. 
Para balancear el Hidrógeno solo debemos modificar el coeficiente del Agua.
Este nuevo coefiente para el Agua será el calculado como la cantidad de Hidrógeno en reactivos dividido la cantidad de Hidrógeno en productos. 
El resultado de esta operación es el nuevo coeficiente para el Agua en productos y permite entonces ya el balance general de la ecuación química.",En proceso…
8,Balance del Oxígeno,El Oxígeno ha sido ya balanceado. Debemos verificar este punto.,En proceso…
9,Simplificación de Coeficientes,"Si es posible, simplificamos todos los coeficientes por el mismo máximo común dividor (mcd).",En proceso…
